{
  "version": "coverage-report/v1",
  "reportMode": "full",
  "engine": {
    "foundryVersion": "0.1.1",
    "coverageMode": "measure",
    "ajvMajor": 8
  },
  "run": {
    "seed": 37,
    "masterSeed": 37,
    "maxInstances": 3,
    "actualInstances": 3,
    "dimensionsEnabled": ["structure", "branches"],
    "excludeUnreachable": false,
    "startedAt": "2025-01-01T12:00:00Z",
    "durationMs": 0
  },
  "metrics": {
    "coverageStatus": "ok",
    "overall": 0.5,
    "byDimension": {
      "structure": 1,
      "branches": 0
    },
    "byOperation": {},
    "targetsByStatus": {
      "active": 2,
      "unreachable": 0,
      "deprecated": 0
    },
    "thresholds": {
      "overall": 0.4
    }
  },
  "targets": [
    {
      "id": "T1",
      "dimension": "structure",
      "kind": "SCHEMA_NODE",
      "canonPath": "#",
      "status": "active",
      "hit": true
    },
    {
      "id": "T2",
      "dimension": "branches",
      "kind": "ONEOF_BRANCH",
      "canonPath": "#/oneOf/0",
      "status": "active",
      "meta": { "planned": false },
      "hit": false
    }
  ],
  "uncoveredTargets": [
    {
      "id": "T2",
      "dimension": "branches",
      "kind": "ONEOF_BRANCH",
      "canonPath": "#/oneOf/0",
      "status": "active",
      "meta": { "planned": false },
      "hit": false
    }
  ],
  "unsatisfiedHints": [],
  "diagnostics": {
    "plannerCapsHit": [
      {
        "dimension": "branches",
        "scopeType": "schema",
        "scopeKey": "dimension:branches",
        "totalTargets": 1,
        "plannedTargets": 0,
        "unplannedTargets": 1
      }
    ],
    "notes": []
  }
}
